{
  "$schema": "https://json-schema.org/draft/2020-12/schema",
  "$id": "https://teploy.github.io/contracts/schema/server-status-envelope.schema.json",
  "title": "server status --json envelope (serverStatusDTO root)",
  "type": "object",
  "required": [
    "machine_interface",
    "server",
    "host",
    "uptime",
    "load",
    "memory",
    "disks",
    "docker",
    "caddy",
    "observed_at",
    "errors"
  ],
  "properties": {
    "machine_interface": {
      "type": "integer",
      "minimum": 1
    },
    "server": {
      "type": "string"
    },
    "host": {
      "type": "string"
    },
    "uptime": {
      "$ref": "#/$defs/uptime"
    },
    "load": {
      "$ref": "#/$defs/load"
    },
    "memory": {
      "$ref": "#/$defs/memory"
    },
    "disks": {
      "type": "array",
      "items": {
        "$ref": "#/$defs/disk"
      }
    },
    "docker": {
      "$ref": "#/$defs/dockerInventory"
    },
    "caddy": {
      "$ref": "#/$defs/caddyObservation"
    },
    "observed_at": {
      "type": "string",
      "format": "date-time"
    },
    "errors": {
      "type": "array",
      "items": {
        "$ref": "#/$defs/machineError"
      }
    }
  },
  "$defs": {
    "machineError": {
      "type": "object",
      "required": [
        "scope",
        "message"
      ],
      "properties": {
        "scope": {
          "type": "string"
        },
        "message": {
          "type": "string"
        }
      }
    },
    "uptime": {
      "type": "object",
      "required": [
        "seconds"
      ],
      "properties": {
        "seconds": {
          "type": "number",
          "minimum": 0
        }
      }
    },
    "load": {
      "type": "object",
      "required": [
        "one",
        "five",
        "fifteen"
      ],
      "properties": {
        "one": {
          "type": "number",
          "minimum": 0
        },
        "five": {
          "type": "number",
          "minimum": 0
        },
        "fifteen": {
          "type": "number",
          "minimum": 0
        }
      }
    },
    "memory": {
      "type": "object",
      "required": [
        "total_bytes",
        "used_bytes",
        "available_bytes"
      ],
      "properties": {
        "total_bytes": {
          "type": "integer",
          "minimum": 0
        },
        "used_bytes": {
          "type": "integer",
          "minimum": 0
        },
        "available_bytes": {
          "type": "integer",
          "minimum": 0
        }
      }
    },
    "disk": {
      "type": "object",
      "required": [
        "filesystem",
        "mountpoint",
        "total_bytes",
        "used_bytes",
        "available_bytes",
        "used_percent"
      ],
      "properties": {
        "filesystem": {
          "type": "string"
        },
        "mountpoint": {
          "type": "string"
        },
        "total_bytes": {
          "type": "integer",
          "minimum": 0
        },
        "used_bytes": {
          "type": "integer",
          "minimum": 0
        },
        "available_bytes": {
          "type": "integer",
          "minimum": 0
        },
        "used_percent": {
          "type": "string"
        }
      }
    },
    "container": {
      "type": "object",
      "required": [
        "id",
        "name",
        "image",
        "state",
        "status",
        "created_at",
        "process",
        "version"
      ],
      "properties": {
        "id": {
          "type": "string"
        },
        "name": {
          "type": "string"
        },
        "image": {
          "type": "string"
        },
        "state": {
          "type": "string"
        },
        "status": {
          "type": "string"
        },
        "created_at": {
          "type": "string"
        },
        "process": {
          "type": "string"
        },
        "version": {
          "type": "string"
        }
      }
    },
    "image": {
      "type": "object",
      "required": [
        "id",
        "repository",
        "tag",
        "size",
        "created_at"
      ],
      "properties": {
        "id": {
          "type": "string"
        },
        "repository": {
          "type": "string"
        },
        "tag": {
          "type": "string"
        },
        "size": {
          "type": "string"
        },
        "created_at": {
          "type": "string"
        }
      }
    },
    "dockerInventory": {
      "type": "object",
      "required": [
        "installed",
        "version",
        "containers",
        "images"
      ],
      "properties": {
        "installed": {
          "type": "boolean"
        },
        "version": {
          "type": "string"
        },
        "containers": {
          "type": "array",
          "items": {
            "$ref": "#/$defs/container"
          }
        },
        "images": {
          "type": "array",
          "items": {
            "$ref": "#/$defs/image"
          }
        }
      }
    },
    "caddyRoute": {
      "type": "object",
      "required": [
        "server",
        "id",
        "hosts",
        "handlers",
        "upstreams",
        "status_code"
      ],
      "properties": {
        "server": {
          "type": "string"
        },
        "id": {
          "type": "string"
        },
        "hosts": {
          "type": "array",
          "items": {
            "type": "string"
          }
        },
        "handlers": {
          "type": "array",
          "items": {
            "type": "string"
          }
        },
        "upstreams": {
          "type": "array",
          "items": {
            "type": "string"
          }
        },
        "status_code": {
          "type": "string"
        }
      }
    },
    "caddyObservation": {
      "type": "object",
      "required": [
        "available",
        "routes"
      ],
      "properties": {
        "available": {
          "type": "boolean"
        },
        "routes": {
          "type": "array",
          "items": {
            "$ref": "#/$defs/caddyRoute"
          }
        }
      }
    }
  }
}
